store_location	store_name	store_rating	user_id	user_rate	user_review	user_time
대전시 유성구 봉명동 1052-5	곰에스프레소		까미유	맛있다	7년전 관저동 작은 곰에스프레소에서 시작하여$e$큰 곰에스프레소..건양대점에 이어...$e$이제 도안점으로..$e$추억속의 관저점은 이제 문을 닫고 $e$건양대점과 도안점에서 곰에스프레소를 만날수 있음.$e$도안점에는 로스팅공장(?)과 곰두목(주인장)이 있고..맛나고 싼 브런치도 맛볼수 있다..ㅋ$e$직접 로스팅하기에 질좋고 맛좋은 원두와 드립,에스프레소를$e$즐길수 있고,끊임없이.연구하는 쥔장의 부지런함의..결과물들$e$(예를 들면.간편하게 어디서나 컵과 끓는물만 있으면 핸드드립을 즐길수 있도록 한 .휴대용드립퍼같은..)도 볼 수 있다.	2014-09-28 19:03:42
대전시 유성구 봉명동 1052-5	곰에스프레소		YunDam	맛있다	샤케라토 맛있음	2016-09-16 00:08:06
대전시 유성구 봉명동 615-1	크래버대게나라		박지연	맛있다	대전 충남대 일이 있어 갔다가-$e$대게나라 대전점에서 식사 했어요-$e$$e$대게요리로 근사한 식사-$e$분위기 좋고$e$맛 좋고$e$무엇보다 빨리빨리 아니고 여유있는 식사$e$해서 좋았어요$e$$e$깔끔한 손질 너무 맘에 들었고-$e$깔끔한 샐러드며.다른 요리들까지-$e$우왕 very good$e$$e$대게.킹크랩.랍스타전문점.$e$참 좋네요-요기!!!대게나라~	2017-05-03 07:45:25
대전시 유성구 봉명동 615-1	크래버대게나라		박지연	맛있다	대게나라 대전유성점에서 맛있게 먹은 $e$살이 통통한 킹크랩$e$고급지고 분위기나는 여기 킹크랩$e$정말 맛있다!!!$e$또 가고 싶은 그런 곳이에요$e$주말인데-요런데서 맛있고 고급진 곳에서$e$먹으면 딱인데...$e$대게나라 좋아욧 GOOD	2017-05-27 08:47:46
대전시 유성구 봉명동 615-1	크래버대게나라		박이✨	맛있다	너무너무 맛있게 먹고 왔어용. 대게나라 대전유성점. 정말 대박맛집이네용. 대게요리 먹기좋게 손질도 너무 잘되어 있어서 너무 좋았구용. 사이드메뉴도 완전 대박~~~하하하	2017-05-18 12:25:17
대전시 유성구 봉명동 562-6	구들마루		MisoMeira	맛있다	대전에서도 산지 2달이 지나면서 한번에 업뎃을 하네요.$e$이번 소개할집은 유성시외버스터미널 근처에 위치한 소곱창전골집인 구들마루$e$평점은 5점 만점에 3.8정도 주고 싶은 집입니다. 밑반찬으로 나오는 도토리묵은 꼭 리필을 해야되고 오이소박이나 도라지 무침또한 괜찮은 구성.$e$곱창전골은 미나리가 비린맛을 잡고 시원한 맛을 주는 맛집. 양도 푸짐해서 3인기준 소자 먹어도 무난합니다. 대신!!! 볶음밥은 비추합니다. 볶음밥만 괜찮았어도 4점 딱 주는데 아쉽아쉽	2016-09-06 18:43:32
대전시 유성구 봉명동 562-6	구들마루		KJH	맛있다	곱창이 쫄깃하고 고소하네요$e$$e$소주가 땡기지만 $e$$e$일행이 무면허라$e$$e$그저 웁니다..	2015-07-26 23:24:08
대전시 유성구 봉명동 562-6	구들마루		송지호	맛있다	누린내도 적고 아주 맛있습니다 이 정도면 곱창전골 중에서 상위권이에요	2016-09-10 17:21:06
대전시 유성구 봉명동 562-6	구들마루		이용화	맛있다	맛있음	2017-04-17 20:19:08
대전시 유성구 봉명동 448-17	궁중보쌈		돌돌 :D	맛있다	여긴 어쩌다가 한번가게된 이후로$e$쭉 가고있는 집이예요~$e$$e$진짜 데리고 간 사람들 중에 만족안한 사람이 없어요$e$$e$보쌈이 평균보다 조금 비싸지만$e$밑반찬이 엄청 잘나오고 맛있어요$e$간이 센경우도 있지만 보쌈과 함께 먹으면 좋아요!!$e$$e$고기는 뭐 두말할 필요가 없죠$e$$e$점심때 만원짜리 점심특선있고$e$김치찌개랑 칼국수도 있어요$e$$e$보쌈이랑 집밥처럼 먹고싶으면 항상 가는집!!	2016-10-02 13:46:14
대전시 유성구 봉명동 448-17	궁중보쌈		ChoHae Jung	괜찮다	밑반찬 많고 친절하셔서 괜찮은데 아쉬운게 보쌈김치가 없더라고요 무말랭이만 있어요....고기는 칠레산인데도 잡냄세 없이 야들한게 맛있었고 양도 보쌈 중짜리 후식 칼국수 2인 성인셋이서 먹었는데 정말 배불리 먹었습니다  이거 먹으러 일부러 찾아갈일은 글쎄 모르겠지만 근처에서 보쌈이 먹고싶다면 또 다시 가볼용의는 있을듯?!ㅋ	2017-06-06 20:29:13
대전시 유성구 봉명동 448-17	궁중보쌈		Hepbsibah:)	맛있다	진짜 맛있어요!!! 친구들 가족들 손님들 모시고 가면 다들 만족하시고 꼭 또 한번 가시더라구요:)	2017-02-28 12:44:52
대전시 유성구 봉명동 552-4	아홉시컴퍼니		준영	맛있다	프릳츠 원두를 사용하는 유성온천역 바로 옆 카페! 인조 잔디가 있는 테라스?가 핫플레이스이긴 하지만 너무 대로변 옆이기도 하고 요즘은 미세먼지 때문에..ㅠㅠ 그냥 안에 앉았어요.$e$ 예전에 프릳츠에서 먹었던 커피는 막 제 취향은 아니었지만 괜찮았는데 이번에도 그냥 그랬어요ㅎㅎ 콜드브루 주문했는데 그냥 특유의 산뜻함 덕분에 맛있게 먹었네요~ 공간 깔끔하고 넓고 공부하기도 괜찮은 듯 해요.	2017-04-07 14:00:06
대전시 유성구 봉명동 640	썸데이제주오겹살		용	맛있다	여긴 진짜 미치게 맛있다$e$제주오겹살 돼지갈비 먹었는데 진짜 맛있음!!$e$참숯으로 직화로 굽는 것도 그렇고 반찬도 하나하나 정갈하고 맛난 것 때문에 비싼 값이 아깝지가 않다$e$반찬은 매일 다른 구성으로 로테이션 되는거 같다$e$양념게장은 매번 나오는데 너무 맛있음ㅎㅎ$e$환기 시설이 잘 돼서 냄새도 잘 안배기고$e$고기도 다 구워주는 친절한 서비스에$e$고기 맛은 진짜 극강$e$진짜 맛있는 고기 먹고 싶은 때 여기 추천한다ㅠㅠ	2016-05-23 10:53:06
대전시 유성구 봉명동 551-16	비단강숯불장어		찐	맛있다	튼실한 비단강장어 전혀비리지않고 담백하니 마싯음$e$장어집 몇군데 가본곳중 가장 잘먹고온곳	2015-07-26 14:04:14
대전시 유성구 봉명동 650	르뺑 99-1		준영	괜찮다	시식 인심이 참 후한 곳이에요. 빵도 참 큼지막하게 잘라주고 종류도 엄청 많아서 한바퀴 돌고나니 그냥 대부분 먹어본 느낌ㅋㅋㅋ 안먹어본 것들 위주로 골라서 샀어요.$e$ 아우어베이커리 더디초코 느낌나는게 있어서 집었는데 몹시 드라이한 더티초코... 안에 초코는 오히려 더 많이 들은 것 같은데 빵 자체가 수분기가 너무 없어요ㅠㅠ$e$ 마롱파이는 꽤 사이즈는 크지만 필링 비율이 조금 아쉬워요! 그리고 얘도 많이 목이 메었어요...수분기 좀ㅠㅠ 머랭쿠키는 그냥 500원이라 싸지만 굳이 사먹징 낳아도 될 정도의 퀄리티!$e$ 시식빵들이 더 맛있는 편이구요. 시식해보신 다음에 맛있었던걸로 구매하시길 추천해요~ 전체적으로 쏘쏘	2017-04-03 23:59:53
대전시 유성구 봉명동 650	르뺑 99-1		박보은	맛있다	바게뜨랑 깜빠뉴 종류 많고 맛있네요!$e$비엔누이즈(페스츄리)류는 쏘쏘인 듯해요.$e$뺑오 쇼콜라 안에 가나슈가 다크라서 좋았지만$e$파사삭한 식감은 아닌듯해요.$e$그래도 물론 파바나 뚜레주르보다는 훨 맛있고 버터 풍미도 나요 :)$e$대전에서 흔한 빵 종류(성심당 출신 빵들ㅋㅋㅋㅋ)가 아니라 좀 다른 빵 종류가 있어서 좋았어요.$e$카페도 같이하고 분위기도 괜찮아서 다음에 또 갈거예요.(건강빵류를 좋아해서...!)$e$$e$사진 속 요 아이는 두 장에 1500인가했는데$e$무화과에 견과류에 크랜베리가 잔뜩 들어가있어요.$e$혼자사는 분들이 사서 드시기에 좋을 듯해요.$e$얼그레이 잼 발라먹었는데 조합 꾸르맛 :9	2017-02-05 17:42:06
대전시 유성구 봉명동 447-10	옛날숯불갈비		쌤J	맛있다	옛날숯불갈비 현충원 쪽으로 이전했어요!!$e$역시나 돼지갈비는 실망시키지 않습니당$e$기본찬도 맛있고 쌈도 싱싱해요ㅎㅎ$e$된장찌개에 엄청 큰 소갈비가 들어있습니다 꼭 시켜드시길!!	2017-06-07 20:10:34
대전시 유성구 봉명동 536-5	스시엔샤브엔		푱	괜찮다	샤브샤브와 스시를 동시에 먹을수 있는 곳이다. 스시는 회전초밥형식이지만 무한으로 먹을수 있다. 퀄리티 때문에 무한으로 주는 곳을 좋아하지는 않는데 여기도 역시 그냥 그런 퀄리티다. 그냥 양으로 승부해야하나 싶다.$e$$e$샤브샤브는 정량으로 나오고 추가하면 금액도 추가지불해야한다. 야채는 무한히 샐러드바에서 가져올수 있어서 이건 참 좋았고 칼국수 사리같은 것도 회전레일에서 등장하니 가져다 먹으면 된다. 그 외에도 간단한 치킨이나 파스타류 약간은 샐러드바에 있고 젤 좋았던건 맥주도 무한 리필이었다.$e$퀄리티는 가격때문에 어쩔수 없지만 배고픈날 가기엔 괜찮을것도 같다.	2017-04-21 00:12:05
대전시 유성구 봉명동 551-10	샤브쌈주머니		푱	맛있다	한우로 점심특선 먹었는데 일인분에 가격은 15.0이었다. 맛이야 일반샤브샤브와 큰 차이는 못느꼈다. $e$가게는 큼직하고 때때론 웨이팅도 하기도 한다. 샐러드바에서 야채든 월남쌈이든 더가져올수있어서 야채 안아껴먹어도 되서 너무너무 좋다. 야채종류도 많아서 좋다. 샤브샤브에 야채가 생명이라고 생각하는 사람들은 가면 좋을듯.$e$샤브샤브 먹은후 쌀국수와 숙주 넣어 끓여먹고 죽까지 끓여먹으면 너무너무 맛있다.	2017-02-05 01:25:59
대전시 유성구 봉명동 552-2	쿠우쿠우		라에	맛있다	오픈한 첫날 가서 20%할인받고 주말이지만 둘이서 31,000에 먹었어요!$e$이벤트때문인지 사람이 많아서 점심 웨이팅30분 있었으나$e$한접시 먹어보고 기다리길 잘했다 했어요 ㅋㅋ$e$스시 및 롤 등의 종류가 30개정도 되는것같았고 맛도 괜찮았어요! 부모님 데리고 한번 더 가도 괜찮을곳인듯 ㅎㅎ$e$좀 아쉬웠던건 디저트류 였는데, 슈크림볼이 생각보다 빵부분이 많아 그럭저럭 그런 맛 이었고(저렴이 슈크림볼맛) 눈꽃빙수의 얼음이 우유얼음이 아니라 그냥얼음이라서 좀 아쉬웠어요. 우유얼음이면 더 맛있었을텐데 ㅜ	2016-05-08 01:07:47
대전시 유성구 봉명동 552-2	쿠우쿠우		LeeKa Eun	괜찮다	맛은 그냥 보통$e$다만 위생상태가 영...$e$새 컵인데 립제품 자국이 남아있고 접시에도 뭐가 묻어있네요;	2016-07-02 14:07:32
대전시 유성구 봉명동 552-2	쿠우쿠우		irene	괜찮다	그냥 그런데 가끔씩 생각날 것 같다	2016-09-03 02:33:37
대전시 유성구 봉명동 611-3	토도쿠야		용	맛있다	파는 메뉴는 이자카얀데 분위기는 포차! 가격대가 높아서인지 직장인 분들같이 연령대가 높았다. 기본 안주로는 오징어 튀김이랑 콩이 나오고 계속 리필 가능. 아사히 생맥주가 -4도로 나온다길래 시켜봤는데 신세계였다ㅠㅠㅜ 타 생맥주랑 너무 비교될 정도로 맛있음!! 회도 신선해서 맛있고, 타코 와사비도 기대한 만큼 맛있고 신선함. 애초에 와사비가 들어가 있으니 따로 나오는 와사비는 많이 넣지 마시길 ㅎㅎ 시끌벅적한 메인 홀 말고 안쪽에 요리사 분들이 계시는 주방 앞자리에 일렬로 앉았는데 밝고 나름 조용한게 괜찮았음. 요리 과정 보고 싶었는데 좀 높아서 그렇게 잘 보이지는 않았다 근데 서비스로 두부치즈 샐러드 주심bb 다음에 와서 메인으로 시키고 싶을 만큼 맛있었다 룸도 있고 일반적인 조용한 분위기도 시끌벅적한 분위기도 즐길 수 있는 독특한 곳	2016-07-03 20:21:03
대전시 유성구 봉명동 536-5	작업반장		푱	맛있다	상가에 위치한 작은? 술집이다. 자리가 많진 않은데 별로 북적이지 않아 얘기하기 좋은 곳이었다.$e$$e$메뉴이름이 민물새우완탕이었던가 ㅎㅎ 여튼 맛나다. 만두는 두개쯤 들어가고 우동사리 쪼끔 들어간다. 딱히 양은 많진 않다. 국물이 좀 매콤한데 칼칼하고 깔끔한 맛. 서비스로 밥을 주셨는데 그냥 밥이 아니라 김가루에 후리가케가 있어 주먹밥을 만들어 먹었다. 국물이랑 먹으니 너무너무 맛났다. $e$$e$이건 소주안주지만 블루베리맥주와 함께 먹었는데 이건 맥주라기보다는 거의 블루베리에이드였다. 그래도 맛은 있었으니 ㅎㅎ	2017-01-24 23:34:49
대전시 유성구 봉명동 641-9	미친등심		알빈	맛있다	퀄리티 괜찮은 소고기이기에 가격은 조금 있습니다.$e$하지만 그만큼 실망스럽지도않아요.$e$안심 진짜 살살 녹습니다	2017-04-07 16:40:02
대전시 유성구 봉명동 619-1	행복조개찜		푱	괜찮다	새로생긴 맛집 골목에 있다$e$딱보기엔 얼마 안되보여서 별거 없겠는데 싶었는데$e$양이 은근히 많다$e$배불러서 다먹진 못했다	2016-04-19 00:55:15
대전시 유성구 봉명동 619-1	행복조개찜		북극곰	맛있다	문어 들어간 조개찜 맛있다! 이날 문어가 좀 커서 만 원 더 추가되었는데 어쨌든 통통하고 좋았음. 여섯이서 술안주로 문어조개찜+면사리3 시켰는데 칼국수사리는 별로였다...	2016-08-18 02:38:31
대전시 유성구 봉명동 619-1	행복조개찜		김젼	별로	3명이 조개찜 중자로 시켰는데 조개 너무 조금이어서 추가조개 시켰는데 것도 너무 조금이었어요...$e$그래서 칼국수랑 볶음밥 시켰는데 볶음밥 진짜 쉣.................참기름 찌꺼기맛?! 아 진짜 돈아까워요 다시 갈 의향 없음	2017-05-31 00:09:38
대전시 유성구 봉명동 466-2	몬스터골뱅이		푱	맛있다	몬골무침!$e$27천원이라 큰 기대를 안했는데 양이 엄청나게 많다. 사진에 보이는거 반도 못먹었다. 넷이서 밥으로 먹어도 될듯.$e$재료도 실하게 들어갔고 뭣보다 골뱅이가 풍부하다.$e$기본으로 순두부도 주시고 특이한게 아이스커피를 같이 주신다. ㅎㅎ 맛나당 담에는 몬골구이를 먹어보고 싶다	2016-05-01 16:04:58
대전시 유성구 봉명동 676-2	돈수백		joooooonit	맛있다	.	2017-02-22 20:56:55
대전시 유성구 봉명동 535	철수네매운갈비찜		백승연	맛있다	갈비를 먹는데 너무 부드럽고 맛있었어요 ㅠㅠ!! 소스에 김치 있는데 그것도 맛있었고요 ! 다만 고기 갯수가 조금 작은것 같아서 아쉬웠어요..ㅠㅠ 치즈볶음밥도 너무 맛있어요! 평일에도 웨이팅을해서 자주가진 않지만 가끔 생각나는맛이에요	2017-01-06 21:16:03
대전시 유성구 봉명동 535	철수네매운갈비찜		jj	맛있다	식당은 크진 않다..굉장히 구식의 인테리어지만 나름의 운치(?)는 있음. 옛날 포장마차의 느낌이며 소주와 함께 먹으면 딱 좋을 유성 맛집 중 하나. $e$$e$기본찬으론 미역국 철판계란프라이 등이 나오고, 메인인 갈비찜은 김치-등갈비-콩나물 떡 등의 순으로 켜켜히 쌓여있는 형태. 물론 매우 맛있 (는 술안주이)고 맵다! \ ^ㅇ^/	2016-09-05 02:57:37
대전시 유성구 봉명동 562-13	만년닭강정		푱	맛있다	테이크아웃해서 먹었다. 매운맛으로 먹었는데 그렇다고 아주 맵지는 않고 좀 사르르 매운 맛이다. 좀 매운거 못먹는 사람들은 이거조차 맵게 느껴질 수 있을것 같다. 나한테는 딱 맛있는정도의 맵기였다. 양은 많아보였는데 둘이서 배부르게 먹기 적진 않은정도?였다 ㅎㅎㅎ	2017-03-01 14:31:13
대전시 유성구 봉명동 562-13	만년닭강정		꿍이	맛있다	과일을 사용해 소스를 만들어서 가게 안에$e$과일이 굉장히 많이 보인다 $e$자연스러운 단맛이 기분이 좋고$e$식은 후가 더 맛있다고 해서 갸우뚱했는데$e$진짜였다 안에 들어가면 닭강정을 일부러 식혀놓고 계시는데 식은게 정말 맛있다$e$나도 맛있게 먹었지만 같이 먹은 친구는 진짜 감동을 하면서 먹었음 조만간 또 사먹을 예정	2016-11-27 00:04:54
대전시 유성구 봉명동 536-5	박종안김밥		JhangInhwan	맛있다	등심수제치즈카츠..$e$이건 마치..영화 <눈물이 주룩주룩>에서 단둘이 살던 집을 떠나는 동생 카오루를 위해 오빠 요타로가 마지막으로 해줬을 법한 요리..	2016-02-19 22:11:53
대전시 유성구 봉명동 441-1	우미일식		백승연	맛있다	유성쯤에서 배달해주는 초밥집 찾다가 알게된 유미일식이에요 ㅎㅎ 2만원 이상부터 배달해주고 제가 2만원 연어초밥 시켰는데 연어초밥, 김주먹밥, 미소국, 죽 이렇게 왔어요 ! 연어는 두툼한편이고 ㅠ 진짜 맛있어요!! (사실 연어 먹기 시작한지 1달 정도밖에 안돼서 연어 잘몰라용 ㅠ) 친구들도 맛있다고 그랬어요!ㅎㅎ 밥 위에 올려진 연어 말고 연어회?를 몇 첩 더 주세요! ㅎㅎ 추천이에용 ㅎㅎ	2017-04-11 00:59:44
대전시 유성구 봉명동 535-8	윤가네뼈다귀해장국		푱	괜찮다	감자탕이 먹고 싶어 왔던 곳.$e$뼈다귀 해장국으로도 파는데 감자탕 전골 소짜리로 시켰다$e$둘이 먹기에는 양이 꽤 있었고 고기도 실해서$e$밥 안시키고 고기만 먹었는데도 배가 충분히 불렀다	2016-05-03 23:53:21
대전시 유성구 봉명동 550-1	미정네		푱	괜찮다	매운게 땡겨서 먹고왔다. 간판이랑 가게 인테리어가 뭔가 휑해서 뭐하는 집인고 했는데 생각보단 괜찮았음. 가게도 좁지 않고 사장님도 살가우셨다.$e$소짜 23000원인데 두명먹긴 딱인거같다. 갈비찜같은게 나올줄알았는데 국물이 흥건하다. 왜 볶음탕이라고 썼는지 알겠다. 색이 빨갛진 않아서 매우려나 했는데 알맞게 매콤해서 먹기 좋다. 고기도 둘이먹긴 충분했다. 이날은 그냥 공기밥에 먹었는데 밥을 볶아먹어도 괜찮았을거같다.	2017-03-14 21:58:53
대전시 유성구 봉명동 656-4	클레버 카페		잉명	괜찮다	인절미 마카롱 짱 맛있습니다! 그에 비하여 케이크는 쫀득초코는 괜찮고, 고구마케이크는 고구마가 너무 마나서 고구마무스 같아요	2017-03-16 20:29:05
대전시 유성구 봉명동 666-4	세븐팩토리		Sirena	괜찮다	음료는 무난한데 서비스가 별로인 듯. 내부도 좀 더운 편임. 인테리어는 특이하니 좋아보이지만 생각보다 좌석이 많이 없고 아주 특별한 강점이 있는 것 같지는 않았음. 굳이 꼽자면 야외석?	2016-05-14 18:18:30
대전시 유성구 봉명동 666-4	세븐팩토리		ChoiMinseok	맛있다	브런치로 샐러드파스타를 종종 먹었는데 상큼하니 아주 맛있다.$e$아메리카노도 괜찮았던 기억.$e$야외석에서 날씨좋은날 여유부리기 매우 좋으며 내부 인테리어도 좋다	2016-11-15 19:33:43
대전시 유성구 봉명동 666-4	세븐팩토리		Kyungsu Kim	맛있다	유성홈플 바로 옆 컨테이너를 이용한 겔러리 카페.$e$낮에는 커피,하겐다즈.. 밤에는 시원한 맥주	2014-06-30 16:53:52
대전시 유성구 봉명동 1016-7	소프레소		현진	맛있다	맛있어요! 아이스크림 위에 초코소스 듬뿍,,ㅎㅎ$e$짱 달달하고 맛있어요:)$e$그리구 친절하세용~~~~	2015-12-16 14:25:18
대전시 유성구 봉명동 552-7	연타발		잰잰	맛있다	대창 이런거 전혀 못먹는데 친구가 맛있대서 갔어요 !!! 근데 왠일 ... 진짜 대창 신세계를 맛봤다능 .. $e$전 대창이런게 엄청 질기고 그래서 싫었는데 여기는 그냥 막 쫀득쫀듁 츄릅츄릅 .. 넘나 잘먹었어요 !!!	2016-01-25 21:27:54
대전시 유성구 봉명동 1030-6	왕가		테오LIFE	맛있다	(사진은 못찍어서 다음방문때 올리겠습니다ㅠㅠ....)$e$칠리깐풍새우?...무튼....새우의 튀김옷도 바삭바삭하고...같이곁들어진 소스가 은근히 중독되더군요....ㅋㅋㅋ 소스때문에 또 한번 먹으러 가고싶습니다ㅋㅋㅋ(근데....가격이...)	2015-11-05 11:31:04
대전시 유성구 봉명동 666-2	임진강장어		G	맛있다	지극히 개인적인 의견입니다.$e$$e$임진강의 장점! 초벌되어있는 장어를 구워준다. 잘 챙겨준다. 맛있다. 원래는 양념구이를 더 좋아하지만 임진강은 소금이가 개인적으론 더 맛있는거 같아요. 단백하고 잡내가 하나도 없어 진짜 맛있는거 같습니다! 평일에도 사람들이 많아서 주말같은경우는 미리 예약해두시는것도 나쁘지않을것같아요!	2015-11-24 19:22:52
대전시 유성구 봉명동 536-10	네네치킨		인성권	괜찮다	일단 순살시켰는데 고기의 퍽퍽함이 약간 있는 정도$e$그외엔 튀김옷이 바삭 하고 3차 먹기엔$e$나쁘지 않앗던 느낌$e$$e$프렌차이즈니깐 뭐 ^^	2015-07-29 10:15:20
대전시 유성구 봉명동 1052-11	비바릴리		EunsilJeon	맛있다	스테이크가 정말 부드러워요!! 소스도 와인이랑 블루베리, 크랜베리 등으로 만들어서 독특하고 고기하고도 잘 어울려요! 가니쉬도 너무 맛있구요~~ 파스타도 자주 먹었는데 이집이 대체로 다 맛있는것같아요 샐러드도 맛있어요ㅋㅋㅋ 샐러드 진짜 짱...	2016-02-17 03:06:54
대전시 유성구 봉명동 1050-4	올림		별이	괜찮다	메뉴가 매일 바뀌는 한식을 먹는 곳.$e$한 사람당 하나의 트레이가 나오는데, 반찬이 정갈하게 골고루 잘 나온다. 거창한 요리보다 소소한 밑반찬들로 이루어져있다. 멸치볶음 미역무침 총각김치 조기구이 콩나물국 같이, 집에서 먹는 듯한 반찬 구성이 나와 부담없이 먹을 수 있다. 국이나 고기양념의 간은 조금 짠 편이었다. $e$지역에 젊은 사람들이 많아서 그런지, 젊은 부부가 아이들을 데리고 나와 주말에 한끼를 하는 모습도 보이고 나이가 있는 분들도 와서 먹고 갔다. 가까이 있으면 점심식사로 몇번 갈 것같은데 일부러 찾아갈 것 같지는 않다ㅠ 직원들의 서비스나 손님을 대하는 태도가 좋지는 않은 편이다. 스피커 질이 좋지 않은지 배경음악이 거슬리는 것은 덤.	2016-11-27 14:31:02
대전시 유성구 봉명동 1054-5	카페106		HanDayoung	괜찮다	체코빵 뜨레들로가 유명한 집! 처음 방문했는데 진짜 쫄깃하고 막 구워나와 따뜻하고 맛있었어요! 커피도 나쁘지 않아요!	2016-10-03 00:06:22
대전시 유성구 봉명동 559-4	우니코		JhangInhwan	맛있다	좋은 점만 말하면,$e$바나나 타르트가 맛있고, 테이블 배치 간격이 넓어 공간이 시원시원함.	2016-02-08 16:55:04
대전시 유성구 봉명동 621-6	국제육가		정동건	맛있다	되게 맛있습니다 고기 질이 정말 좋아요!!$e$목살 굿!!$e$$e$밑반찬도 많이 주네용	2017-01-23 17:37:12
대전시 유성구 봉명동 650	수리왕족발보쌈		백승연	괜찮다	야식으로 족발 시켜먹었는데 엄청 맛있는건 아니지만 ㅎㅎ 그래도 만족하면서 먹었어요! ㅎㅎ 아마 시키시면 감동은 없어도 실망은 안 하실거에요ㅋㅋㅋ$e$시험기간엔 야식이 최고..ㅎㅎ!	2017-04-21 00:07:32
대전시 유성구 봉명동 550-11	임해조볼테기		석조©삶과꿈	괜찮다		2014-06-30 23:49:43
대전시 유성구 봉명동 556-23	신순님추어랑오리랑		JhangInhwan	맛있다	추어탕 든든함	2016-01-24 01:46:28
대전시 유성구 봉명동 669	애슐리		안대현	괜찮다	애슐리 맛있습니다.. 대전 애슐리중 가장괜찮다고 들었구요 신메뉴 추가된것도 좋아요 바베큐 할때 오시는게 좋아요	2015-06-27 14:02:45
대전시 유성구 봉명동 543-16	오모리찌개		임완중	별로	조미료맛...	2016-09-27 18:48:11
대전시 유성구 봉명동 543-16	오모리찌개		전현정	맛있다	맛있어요 bb 인생 짜장이엇음 ㅎ	2016-08-13 12:57:02
대전시 유성구 봉명동 443-9	가드니아뷔페		소연	괜찮다		2015-03-15 19:08:53
대전시 유성구 봉명동 675-1	개성집		joooooonit	맛있다	.	2017-05-17 15:20:16
대전시 유성구 봉명동 538-16	온천칼국수		joooooonit	맛있다	.	2017-04-04 12:25:47
