,Comment,Comment ID,Member ID,Member Nickname,Rating,Restaurant Address,Restaurant Cusine,Restaurant ID,Restaurant Latitude,Restaurant Longitude,Restaurant Name,Time
0,"스테이크무한리필이래서 다녀왓는데 생각만큼 맛난곳은 아니엇음 서브로 주문한 스테이크가 훨씬 맛낫음
근데 주말만가능한스테이크엿음 베이비폭립인가는 소스가 너무달아서 애들용.. 리필은 시간이 엄청오래걸림",159352,199425,찐,1,대전시 서구 가수원동 1062,1,216611,36.30347443,127.34941101,담스하우스,2015-08-06 14:34:35
1,"짬뽕 전문점

메뉴는 빨간 짬뽕과 하얀 짬뽕, 짜장면, 탕수육.

탕수육 튀김옷을 찹쌀떡으로 만들어서 정말 맛있다.

짬뽕을 시키면 작은 공기밥을 같이 준다.",34129,10516,찌용??,3,대전시 서구 가수원동 954,2,37046,36.306701,127.3521401,이비가짬뽕,2014-04-09 01:10:12
2,"얼큰한짬뽕 과 찹쌀탕수육은 맛있습니다. 
그러나 자장면은 3분 짜장을 면위에 뿌려주는
그런 싸구려맛.....",119342,62110,GunhoChoi,2,대전시 서구 가수원동 954,2,37046,36.306701,127.3521401,이비가짬뽕,2015-02-15 23:33:08
3,여기진짜짱맛있어요 작은데 너무 분위기좋구 당근케잌은 꼭먹어봐야대요!!,174880,398653,이용금,2,대전시 서구 가수원동 924,7,191895,36.3079129,127.3491441,카페쉐로사,2015-10-18 01:49:03
4,분위기도 좋고!! 치킨 완전 맛있음~~!!강력 ㅊㅊ 가격도 엄청 괜찮음!! 치킨바도 먹었는데 존맛간장치킨먹었는데 짜지도 싱겁지도 않은 딱 좋은 맛>_< 그리고 사장님의 특별서비스 고구마 스노우시즈닝 튀김 존맛입니다 꼭오세요 두번오세요,186652,449192,홍유정,3,대전시 서구 가수원동 790-4,1,232185,36.3013364,127.3534434,처음본두마리치킨,2015-12-25 15:05:21
5,"전. 별로던데..
간판에 배달안시키고 직접방문하면 할인해준다는 에어풍선. 광고 하면서 .. 직접방문해도 할인안해주고..
치킨도 별로였어요.
 치킨은 거의 맛있어하는데.. 후라이드는 깨끗했지만 양념은. 밍밍하고..ㅋ

뭣보다 동네에서 장사하면서 너무 속보이는게 티나요.
전 다신안감

",193052,466268,SonMinkyung,1,대전시 서구 가수원동 790-4,1,232185,36.3013364,127.3534434,처음본두마리치킨,2016-01-18 23:51:47
6,딱 들어가자 마자 연탄가스 냄새부터 확 몰려오고 전체적으로 가게 분위기가 너무 썰렁하고 어수선하네요. 해물순두부는 두부도 별로 없는데다가 해산물도 냉동을 쓰는게 너무 티가 많이나고 맑은순두부는 그럭저럭 먹을만 했어요. 밑반찬은 매운 멸치볶음 빼곤 다 별로;; 그냥 음식 솜씨가 별로 없으신듯,277695,507356,성지호,1,대전시 서구 가수원동 188-1,1,240712,36.30524449,127.35614048,두부집,2016-11-03 22:12:31
7,"우미린 아파트 근처에 있는 묵집. 한 2월 중순~말 쯤에 가족끼리 갔다. 음식은 전체적으로 담백하고 깔끔함. 반찬은 이것저것 나온다. 
묵전이랑 잡채시키고 식사류? 로 덮밥이랑 묵국수랑 들깨 수제비 먹었다. 전보다 잡채가 맛있었다. 약간 양장피?!? 뭐라하지 아무튼 겨자 소스를 뿌려먹으라고 주는데 안뿌린게 담백하니 좋았다. 
밥막는데, 묵국수가 관광지 포차에서 파는 그런맛이 아니라 좋았닼ㅋㅋㅋ 들깨는 고소하니 맛있음. 근데 수제비가 좀더 푹 퍼졌으면 좋겠다 난 퍼진거 젛아하는데 너무 쩔깃 거렸음. 그래서 엄마가 국물만 다 먹는다고 뭐라고 하셨닼ㅋㅋㅋㅋ 덮밥은 못먹어봐서 뭐라고 못하겠음. 아무튼 요리에 묵은 다 들어간다. 덮밥이라 없을 줄 알았는데 건조묵이 들어가고 수재비는 묵수제빜ㅋㅋㅋㅋㅋ 
단점을 쓰자면 손님이 별로 없다. 사실 그래서 리뷰 씀ㅋㅋ 그리고 요리 비주얼이 화려한 맛이 없다.
전체적으로 가볼만 하다. 할머니 모시고 가기 젛을것같다. 하지만 맵!짜!달! 이런 느낌이 아니라 호불호가 갈릴 것 같다. 가족모임 하기엔 좋을듯. 의외로 시킬게 많음. 
묵국수랑 들깨수제비는 시켜보는걸 추천한다. 아 잡채도. 그리고 들깨 사진이 없다..ㅎ",321765,746601,짜자자자ㅏ잔,3,대전시 서구 가수원동 914,1,283846,36.3071586,127.3493954,송가네묵사랑,2017-03-22 01:01:28
8,나베에 찍어먹는 소스가 너무 잘어울려서 맛있었음! 개인적으로 우동면사리 보단 죽이 더 더 맛남,328776,760788,둥이맘,3,대전시 서구 가수원동 1035,3,273483,36.30625282,127.35160236,나베코이,2017-04-12 18:21:19
